{
  "lastUpdated": "2026-06-01",
  "id": "ai2m2ia",
  "displayName": "AI(2)M(2)IA",
  "taglines": ["One impossible book at a time."],
  "signatureLines": ["The symbiosis continues."],
  "bio": "AI(2)M(2)IA is an ongoing experiment in AI-assisted literary fiction. The project publishes books and media with explicit disclosure that AI assisted drafting, editorial refinement, cover art, audio/video preparation, and ebook production while human direction, judgment, structure, ethics, revision, and publication responsibility remain non-delegable.",
  "aiDisclosure": "The books and media are human-directed and AI-assisted. AI can generate text, propose revisions, prepare assets, and accelerate production, but it does not decide what should be published, what claims are true, what a character means, or whether a book deserves to exist.",
  "responsibilityFrame": "The project treats AI like a calculator, a computer, or a typewriter: a tool that changes what humans spend effort on. Calculators did not remove responsibility for calculation. Typewriters did not remove authorship. AI assistance shifts work toward selection, structure, taste, ethics, verification, and revision.",
  "toolAnalogies": {
    "calculatorComputer": "Computers and calculators reduce mechanical burden, but a human remains responsible for the problem, the interpretation, and the consequences of the result.",
    "typewriterHandwriting": "A typewriter changes the physical act of writing without making the machine the author. AI changes drafting mechanics, but the human remains responsible for judgment and publication."
  },
  "externalLinks": {
    "amazon": "https://www.amazon.com/stores/AI%282%29M%282%29IA-AI%282%29M%282%29IA/author/B0GYDYRL75",
    "youtube": "https://www.youtube.com/@AI2M2IA",
    "tiktok": "https://www.tiktok.com/@ai2m2ia"
  }
}
